<?xml version="1.0" encoding="UTF-8"?>
<!--
 ~ Copyright (c) 2009-2010, WSO2 Inc. (http://www.wso2.org) All Rights Reserved.
 ~
 ~ Licensed under the Apache License, Version 2.0 (the "License");
 ~ you may not use this file except in compliance with the License.
 ~ You may obtain a copy of the License at
 ~
 ~      http://www.apache.org/licenses/LICENSE-2.0
 ~
 ~ Unless required by applicable law or agreed to in writing, software
 ~ distributed under the License is distributed on an "AS IS" BASIS,
 ~ WITHOUT WARRANTIES OR CONDITIONS OF ANY KIND, either express or implied.
 ~ See the License for the specific language governing permissions and
 ~ limitations under the License.
-->

<wsa:EndpointReference
        xmlns:xsi="http://www.w3.org/2001/XMLSchema-instance"
        xsi:schemaLocation="http://www.w3schools.com uep_schema.xsd"
        xmlns:wsa="http://www.w3.org/2005/08/addressing"
        xmlns:wsdl11="http://schemas.xmlsoap.org/wsdl/">
    <wsa:Address>http://www.somecompany.com/my-service/svc/</wsa:Address>
    <wsa:ReferenceParameters>ANY</wsa:ReferenceParameters>
    <wsa:Metadata>
        <id>
            <name>foouniquename</name>
            <uuid>UUID</uuid>
            <scope>URI</scope>
            <type>QName</type>
        </id>

        <wsdl11:definitions>ANY</wsdl11:definitions>

	<transport type="http">                
		<Transfer-Encoding>chunked</Transfer-Encoding>                    
		<property-key>property-value</property-key>
        <authorization-username>admin</authorization-username>
        <authorization-password>admin</authorization-password>                   
	</transport>

        <messageOutput format="soap11" optimize="mtom">
            <transport type="http">
                <request-chunk value="true"/>
                <protocol-version value="1_0"/>
                <request-gzip value="true"/>
                <accept-gzip value="true"/>
                <connection-timeout value="1000"/>
                <socket-timeout value="100"/>
                <protocol-max-redirects value="2"/>
                <proxy host="http://localhost" port="9000" domain="http://localhost2" user="foo" password="pwd"/>
            </transport>

            <timeout>
                <duration>15000</duration>
                <action>discard</action>
            </timeout>
        </messageOutput>

        <monitoring statistics="enable" trace="enable">
            log_statement
        </monitoring>

        <errorHandling>
            <markForSuspensionOnFailure>
                <errorCodes>404</errorCodes>
                <retriesBeforeSuspension>100</retriesBeforeSuspension>
                <retryDelay>32</retryDelay>
            </markForSuspensionOnFailure>

            <suspendOnFailure>
                <errorCodes>607</errorCodes>
                <initialDuration>232</initialDuration>
                <progressionFactor>3</progressionFactor>
                <maximumDuration>1000</maximumDuration>
            </suspendOnFailure>
        </errorHandling>

        <qos>
            <enableRM policy="mypolicy.xml"/>
            <enableWsSec policy="secpolicy.xml"/>
            <enableAddressing version="final" separateListener="true">
                <ReplyTo>http://wso2.org/services/uepRefService</ReplyTo>
            </enableAddressing>
            <security>
                <userpwdPair username="user1" password="pwd"/>
                ANY : other security policies
            </security>
        </qos>


        <session type="http"/>

        <cluster>
            <membership membershipHandler="org.apache.synapse.core.LoadBalanceMembershipHandlerImpl">
                <!--<wsa:EndpointReference>
                </wsa:EndpointReference>-->
                <member url="http://localhost:8280/SrtProxy"/> <!--Either this or WSP EP-->
                <properties>
                    <property name="name" value="VAL"/>
                </properties>
            </membership>

            <loadBalance policy="roundRobin" algorithm="org.apache.synapse.endpoints.algorithms.LoadbalanceAlgorithmIMPL"/>
            <failover/>
        </cluster>

    </wsa:Metadata>

</wsa:EndpointReference>


